[
  {
    "id": "tiger",
    "name_en": "Tiger",
    "class": "Mammal",
    "diet": "Carnivore",
    "habitat": ["Forest", "Grassland"],
    "continents": ["Asia"],
    "size_kg": [90.0, 310.0],
    "lifespan_years": [8.0, 20.0],
    "emoji": "üêÖ",
    "image": ""
  },
  {
    "id": "elephant",
    "name_en": "Elephant",
    "class": "Mammal",
    "diet": "Herbivore",
    "habitat": ["Savanna", "Grassland", "Forest"],
    "continents": ["Africa", "Asia"],
    "size_kg": [2200.0, 6000.0],
    "lifespan_years": [50.0, 70.0],
    "emoji": "üêò",
    "image": ""
  },
  {
    "id": "lion",
    "name_en": "Lion",
    "class": "Mammal",
    "diet": "Carnivore",
    "habitat": ["Savanna", "Grassland"],
    "continents": ["Africa"],
    "size_kg": [150.0, 250.0],
    "lifespan_years": [8.0, 16.0],
    "emoji": "ü¶Å",
    "image": ""
  },
  {
    "id": "giraffe",
    "name_en": "Giraffe",
    "class": "Mammal",
    "diet": "Herbivore",
    "habitat": ["Savanna", "Grassland"],
    "continents": ["Africa"],
    "size_kg": [800.0, 1200.0],
    "lifespan_years": [20.0, 30.0],
    "emoji": "ü¶í",
    "image": ""
  },
  {
    "id": "zebra",
    "name_en": "Zebra",
    "class": "Mammal",
    "diet": "Herbivore",
    "habitat": ["Savanna", "Grassland"],
    "continents": ["Africa"],
    "size_kg": [200.0, 450.0],
    "lifespan_years": [20.0, 30.0],
    "emoji": "ü¶ì",
    "image": ""
  },
  {
    "id": "panda",
    "name_en": "Panda",
    "class": "Mammal",
    "diet": "Herbivore",
    "habitat": ["Forest", "Mountain"],
    "continents": ["Asia"],
    "size_kg": [70.0, 120.0],
    "lifespan_years": [15.0, 20.0],
    "emoji": "üêº",
    "image": ""
  },
  {
    "id": "kangaroo",
    "name_en": "Kangaroo",
    "class": "Mammal",
    "diet": "Herbivore",
    "habitat": ["Grassland", "Desert"],
    "continents": ["Australia"],
    "size_kg": [18.0, 90.0],
    "lifespan_years": [6.0, 23.0],
    "emoji": "ü¶ò",
    "image": ""
  },
  {
    "id": "polar_bear",
    "name_en": "Polar Bear",
    "class": "Mammal",
    "diet": "Carnivore",
    "habitat": ["Arctic", "Coast"],
    "continents": ["North America", "Europe", "Asia"],
    "size_kg": [180.0, 700.0],
    "lifespan_years": [15.0, 25.0],
    "emoji": "üêª‚Äç‚ùÑÔ∏è",
    "image": ""
  },
  {
    "id": "dolphin",
    "name_en": "Dolphin",
    "class": "Mammal",
    "diet": "Carnivore",
    "habitat": ["Ocean"],
    "continents": ["Global"],
    "size_kg": [90.0, 300.0],
    "lifespan_years": [20.0, 50.0],
    "emoji": "üê¨",
    "image": ""
  },
  {
    "id": "sea_lion",
    "name_en": "Sea Lion",
    "class": "Mammal",
    "diet": "Carnivore",
    "habitat": ["Ocean", "Coast"],
    "continents": ["North America", "South America", "Asia", "Australia"],
    "size_kg": [90.0, 350.0],
    "lifespan_years": [14.0, 30.0],
    "emoji": "ü¶≠",
    "image": ""
  },
  {
    "id": "horse",
    "name_en": "Horse",
    "class": "Mammal",
    "diet": "Herbivore",
    "habitat": ["Grassland"],
    "continents": ["Global"],
    "size_kg": [380.0, 1000.0],
    "lifespan_years": [20.0, 30.0],
    "emoji": "üêé",
    "image": ""
  },
  {
    "id": "wolf",
    "name_en": "Wolf",
    "class": "Mammal",
    "diet": "Carnivore",
    "habitat": ["Forest", "Tundra", "Mountain"],
    "continents": ["North America", "Europe", "Asia"],
    "size_kg": [30.0, 80.0],
    "lifespan_years": [6.0, 13.0],
    "emoji": "üê∫",
    "image": ""
  },
  {
    "id": "koala",
    "name_en": "Koala",
    "class": "Mammal",
    "diet": "Herbivore",
    "habitat": ["Forest"],
    "continents": ["Australia"],
    "size_kg": [4.0, 15.0],
    "lifespan_years": [10.0, 15.0],
    "emoji": "üê®",
    "image": ""
  },
  {
    "id": "fox",
    "name_en": "Fox",
    "class": "Mammal",
    "diet": "Omnivore",
    "habitat": ["Forest", "Urban", "Grassland"],
    "continents": ["Europe", "Asia", "North America", "Africa"],
    "size_kg": [5.0, 14.0],
    "lifespan_years": [3.0, 6.0],
    "emoji": "ü¶ä",
    "image": ""
  },
  {
    "id": "brown_bear",
    "name_en": "Brown Bear",
    "class": "Mammal",
    "diet": "Omnivore",
    "habitat": ["Forest", "Mountain"],
    "continents": ["Europe", "Asia", "North America"],
    "size_kg": [80.0, 600.0],
    "lifespan_years": [20.0, 30.0],
    "emoji": "üêª",
    "image": ""
  },
  {
    "id": "bison",
    "name_en": "Bison",
    "class": "Mammal",
    "diet": "Herbivore",
    "habitat": ["Grassland"],
    "continents": ["North America", "Europe"],
    "size_kg": [300.0, 1000.0],
    "lifespan_years": [15.0, 20.0],
    "emoji": "ü¶¨",
    "image": ""
  },
  {
    "id": "hippopotamus",
    "name_en": "Hippopotamus",
    "class": "Mammal",
    "diet": "Herbivore",
    "habitat": ["Freshwater"],
    "continents": ["Africa"],
    "size_kg": [1300.0, 3200.0],
    "lifespan_years": [40.0, 50.0],
    "emoji": "ü¶õ",
    "image": ""
  },
  {
    "id": "rhinoceros",
    "name_en": "Rhinoceros",
    "class": "Mammal",
    "diet": "Herbivore",
    "habitat": ["Savanna", "Grassland"],
    "continents": ["Africa", "Asia"],
    "size_kg": [800.0, 2300.0],
    "lifespan_years": [35.0, 50.0],
    "emoji": "ü¶è",
    "image": ""
  },
  {
    "id": "cheetah",
    "name_en": "Cheetah",
    "class": "Mammal",
    "diet": "Carnivore",
    "habitat": ["Savanna", "Grassland"],
    "continents": ["Africa"],
    "size_kg": [21.0, 72.0],
    "lifespan_years": [10.0, 12.0],
    "emoji": "üêÜ",
    "image": ""
  },
  {
    "id": "leopard",
    "name_en": "Leopard",
    "class": "Mammal",
    "diet": "Carnivore",
    "habitat": ["Forest", "Savanna"],
    "continents": ["Africa", "Asia"],
    "size_kg": [17.0, 90.0],
    "lifespan_years": [12.0, 17.0],
    "emoji": "",
    "image": ""
  },
  {
    "id": "jaguar",
    "name_en": "Jaguar",
    "class": "Mammal",
    "diet": "Carnivore",
    "habitat": ["Rainforest", "Swamp"],
    "continents": ["South America", "North America"],
    "size_kg": [45.0, 110.0],
    "lifespan_years": [12.0, 15.0],
    "emoji": "",
    "image": ""
  },
  {
    "id": "lynx",
    "name_en": "Lynx",
    "class": "Mammal",
    "diet": "Carnivore",
    "habitat": ["Forest", "Mountain"],
    "continents": ["Europe", "Asia", "North America"],
    "size_kg": [8.0, 30.0],
    "lifespan_years": [10.0, 14.0],
    "emoji": "",
    "image": ""
  },
  {
    "id": "hyena",
    "name_en": "Hyena",
    "class": "Mammal",
    "diet": "Carnivore",
    "habitat": ["Savanna", "Grassland"],
    "continents": ["Africa"],
    "size_kg": [40.0, 86.0],
    "lifespan_years": [12.0, 25.0],
    "emoji": "",
    "image": ""
  },
  {
    "id": "meerkat",
    "name_en": "Meerkat",
    "class": "Mammal",
    "diet": "Omnivore",
    "habitat": ["Desert", "Grassland"],
    "continents": ["Africa"],
    "size_kg": [0.6, 1.0],
    "lifespan_years": [6.0, 12.0],
    "emoji": "",
    "image": ""
  },
  {
    "id": "chimpanzee",
    "name_en": "Chimpanzee",
    "class": "Mammal",
    "diet": "Omnivore",
    "habitat": ["Rainforest", "Forest"],
    "continents": ["Africa"],
    "size_kg": [32.0, 60.0],
    "lifespan_years": [30.0, 40.0],
    "emoji": "",
    "image": ""
  },
  {
    "id": "gorilla",
    "name_en": "Gorilla",
    "class": "Mammal",
    "diet": "Herbivore",
    "habitat": ["Rainforest", "Forest"],
    "continents": ["Africa"],
    "size_kg": [100.0, 220.0],
    "lifespan_years": [35.0, 40.0],
    "emoji": "",
    "image": ""
  },
  {
    "id": "orangutan",
    "name_en": "Orangutan",
    "class": "Mammal",
    "diet": "Omnivore",
    "habitat": ["Rainforest"],
    "continents": ["Asia"],
    "size_kg": [30.0, 100.0],
    "lifespan_years": [35.0, 45.0],
    "emoji": "",
    "image": ""
  },
  {
    "id": "baboon",
    "name_en": "Baboon",
    "class": "Mammal",
    "diet": "Omnivore",
    "habitat": ["Savanna", "Forest"],
    "continents": ["Africa"],
    "size_kg": [14.0, 40.0],
    "lifespan_years": [20.0, 30.0],
    "emoji": "",
    "image": ""
  },
  {
    "id": "lemur",
    "name_en": "Lemur",
    "class": "Mammal",
    "diet": "Omnivore",
    "habitat": ["Forest"],
    "continents": ["Africa"],
    "size_kg": [1.2, 3.5],
    "lifespan_years": [10.0, 20.0],
    "emoji": "",
    "image": ""
  },
  {
    "id": "sloth",
    "name_en": "Sloth",
    "class": "Mammal",
    "diet": "Herbivore",
    "habitat": ["Rainforest"],
    "continents": ["South America", "Central America"],
    "size_kg": [3.0, 7.0],
    "lifespan_years": [15.0, 30.0],
    "emoji": "",
    "image": ""
  },
  {
    "id": "otter",
    "name_en": "Otter",
    "class": "Mammal",
    "diet": "Carnivore",
    "habitat": ["Freshwater", "Coast"],
    "continents": ["North America", "South America", "Europe", "Asia"],
    "size_kg": [5.0, 45.0],
    "lifespan_years": [10.0, 16.0],
    "emoji": "",
    "image": ""
  },
  {
    "id": "beaver",
    "name_en": "Beaver",
    "class": "Mammal",
    "diet": "Herbivore",
    "habitat": ["Freshwater", "Forest"],
    "continents": ["North America", "Europe"],
    "size_kg": [11.0, 32.0],
    "lifespan_years": [10.0, 20.0],
    "emoji": "",
    "image": ""
  },
  {
    "id": "raccoon",
    "name_en": "Raccoon",
    "class": "Mammal",
    "diet": "Omnivore",
    "habitat": ["Forest", "Urban"],
    "continents": ["North America"],
    "size_kg": [3.0, 9.0],
    "lifespan_years": [2.0, 5.0],
    "emoji": "",
    "image": ""
  },
  {
    "id": "skunk",
    "name_en": "Skunk",
    "class": "Mammal",
    "diet": "Omnivore",
    "habitat": ["Forest", "Grassland", "Urban"],
    "continents": ["North America"],
    "size_kg": [1.0, 4.0],
    "lifespan_years": [3.0, 7.0],
    "emoji": "",
    "image": ""
  },
  {
    "id": "moose",
    "name_en": "Moose",
    "class": "Mammal",
    "diet": "Herbivore",
    "habitat": ["Forest", "Tundra"],
    "continents": ["North America", "Europe", "Asia"],
    "size_kg": [200.0, 700.0],
    "lifespan_years": [15.0, 25.0],
    "emoji": "",
    "image": ""
  },
  {
    "id": "reindeer",
    "name_en": "Reindeer",
    "class": "Mammal",
    "diet": "Herbivore",